{
    "$schema": "https://json-schema.org/draft/2020-12/schema",
    "$id": "https://aiflow.local/schemas/evidence.schema.json",
    "title": "AI Flow evidence",
    "type": "object",
    "additionalProperties": false,
    "required": [
        "schema_version",
        "task_id",
        "decision_unit_ids",
        "repository_id",
        "branch",
        "base_commit",
        "subject_commit",
        "spec_sha256",
        "policy_sha256",
        "classification_input_sha256",
        "verification_level",
        "mode",
        "checks",
        "unverified_scenarios",
        "conclusion",
        "generated_at",
        "reproduce_command"
    ],
    "properties": {
        "schema_version": {"enum": ["1.0", "2.0"]},
        "task_id": {"type": "string", "pattern": "^TASK-[0-9]{4,}$"},
        "decision_unit_ids": {
            "type": "array",
            "minItems": 1,
            "uniqueItems": true,
            "items": {"type": "string", "pattern": "^DU-[0-9]{3,}$"}
        },
        "repository_id": {"type": "string", "format": "uuid"},
        "branch": {"type": "string", "minLength": 1},
        "base_commit": {"type": "string", "pattern": "^[0-9a-f]{40}$"},
        "subject_commit": {"type": "string", "pattern": "^[0-9a-f]{40}$"},
        "attestation_head": {"type": "string", "pattern": "^[0-9a-f]{40}$"},
        "attestation_governance_only": {"type": "boolean"},
        "spec_sha256": {"type": "string", "pattern": "^[0-9a-f]{64}$"},
        "policy_sha256": {"type": "string", "pattern": "^[0-9a-f]{64}$"},
        "classification_input_sha256": {"type": "string", "pattern": "^[0-9a-f]{64}$"},
        "verification_level": {"enum": ["V0", "V1", "V2"]},
        "mode": {"enum": ["local", "ci"]},
        "checks": {"type": "array", "items": {"$ref": "#/$defs/check"}},
        "unverified_scenarios": {"type": "array", "items": {"type": "string"}, "uniqueItems": true},
        "conclusion": {"enum": ["passed", "failed", "provisional"]},
        "generated_at": {"type": "string", "format": "date-time"},
        "reproduce_command": {"type": "array", "minItems": 1, "items": {"type": "string"}},
        "verifier_actor": {"type": "string", "minLength": 1},
        "verifier_context_sha256": {"type": "string", "pattern": "^[0-9a-f]{64}$"},
        "phase": {"enum": ["pre_implementation_review", "final"]},
        "verification_snapshot_sha256": {"type": "string", "pattern": "^[0-9a-f]{64}$"},
        "review_refs": {"$ref": "#/$defs/review_refs"},
        "targeted_mutation": {"$ref": "#/$defs/targeted_mutation"}
    },
    "allOf": [
        {
            "if": {"properties": {"mode": {"const": "ci"}}, "required": ["mode"]},
            "then": {"required": ["attestation_head", "attestation_governance_only"]}
        },
        {
            "if": {
                "properties": {"schema_version": {"const": "1.0"}},
                "required": ["schema_version"]
            },
            "then": {
                "properties": {"verification_level": {"enum": ["V0", "V1"]}},
                "not": {
                    "anyOf": [
                        {"required": ["verifier_actor"]},
                        {"required": ["verifier_context_sha256"]},
                        {"required": ["phase"]},
                        {"required": ["verification_snapshot_sha256"]},
                        {"required": ["review_refs"]},
                        {"required": ["targeted_mutation"]}
                    ]
                }
            }
        },
        {
            "if": {
                "properties": {"schema_version": {"const": "2.0"}},
                "required": ["schema_version"]
            },
            "then": {
                "properties": {"verification_level": {"const": "V2"}},
                "required": [
                    "verifier_actor",
                    "verifier_context_sha256",
                    "phase",
                    "verification_snapshot_sha256",
                    "review_refs",
                    "targeted_mutation"
                ],
                "allOf": [
                    {
                        "properties": {
                            "checks": {
                                "contains": {
                                    "properties": {
                                        "check_id": {"const": "acceptance"},
                                        "required": {"const": true}
                                    },
                                    "required": ["check_id", "required"]
                                },
                                "minContains": 1
                            }
                        }
                    },
                    {
                        "properties": {
                            "checks": {
                                "contains": {
                                    "properties": {
                                        "check_id": {"const": "integration"},
                                        "required": {"const": true}
                                    },
                                    "required": ["check_id", "required"]
                                },
                                "minContains": 1
                            }
                        }
                    },
                    {
                        "properties": {
                            "checks": {
                                "contains": {
                                    "properties": {
                                        "check_id": {"const": "targeted_mutation"},
                                        "required": {"const": true}
                                    },
                                    "required": ["check_id", "required"]
                                },
                                "minContains": 1
                            }
                        }
                    },
                    {
                        "properties": {
                            "checks": {
                                "contains": {
                                    "properties": {
                                        "check_id": {"const": "independent_verifier"},
                                        "required": {"const": true}
                                    },
                                    "required": ["check_id", "required"]
                                },
                                "minContains": 1
                            }
                        }
                    },
                    {
                        "if": {"properties": {"phase": {"const": "pre_implementation_review"}}, "required": ["phase"]},
                        "then": {"properties": {"review_refs": {"not": {"required": ["implementation"]}}}}
                    },
                    {
                        "if": {"properties": {"phase": {"const": "final"}}, "required": ["phase"]},
                        "then": {"properties": {"review_refs": {"required": ["implementation"]}}}
                    }
                ]
            }
        }
    ],
    "$defs": {
        "check": {
            "type": "object",
            "additionalProperties": false,
            "required": [
                "check_id",
                "category",
                "status",
                "reason_code",
                "required",
                "exit_code",
                "timed_out",
                "duration_ms",
                "stdout_log_ref",
                "stderr_log_ref",
                "command_summary",
                "tool_version"
            ],
            "properties": {
                "check_id": {"type": "string"},
                "category": {"type": "string"},
                "status": {"enum": ["passed", "failed", "unverified"]},
                "reason_code": {"type": ["string", "null"]},
                "required": {"type": "boolean"},
                "exit_code": {"type": ["integer", "null"]},
                "timed_out": {"type": "boolean"},
                "duration_ms": {"type": "integer", "minimum": 0},
                "stdout_log_ref": {"type": ["string", "null"]},
                "stderr_log_ref": {"type": ["string", "null"]},
                "command_summary": {"type": "string"},
                "tool_version": {"type": "string"}
            }
        },
        "review_ref": {
            "type": "object",
            "additionalProperties": false,
            "required": ["review_id", "context_sha256"],
            "properties": {
                "review_id": {"type": "string", "pattern": "^REV-[0-9]{4,}$"},
                "context_sha256": {"type": "string", "pattern": "^[0-9a-f]{64}$"}
            }
        },
        "review_refs": {
            "type": "object",
            "additionalProperties": false,
            "required": ["design"],
            "properties": {
                "design": {"$ref": "#/$defs/review_ref"},
                "implementation": {"$ref": "#/$defs/review_ref"}
            }
        },
        "targeted_mutation_result": {
            "type": "object",
            "additionalProperties": false,
            "required": ["mutation_id", "outcome", "log_ref"],
            "properties": {
                "mutation_id": {"type": "string", "pattern": "^MUT-V2-[0-9]{3}$"},
                "outcome": {"enum": ["killed", "survived", "unverified"]},
                "log_ref": {"type": ["string", "null"]}
            }
        },
        "targeted_mutation": {
            "type": "object",
            "additionalProperties": false,
            "required": ["evidence_ref", "mutation_evidence_sha256", "manifest_ref", "results"],
            "properties": {
                "evidence_ref": {"type": "string", "pattern": "^\\.ai/tasks/TASK-[0-9]{4,}/logs/MUTRUN-[0-9]{8}T[0-9]{6}Z-[0-9a-f]{16}/targeted-mutation/evidence\\.json$"},
                "mutation_evidence_sha256": {"type": "string", "pattern": "^[0-9a-f]{64}$"},
                "manifest_ref": {"const": ".ai/mutations/phase-02-critical-manifest.json"},
                "results": {
                    "type": "array",
                    "minItems": 5,
                    "maxItems": 5,
                    "uniqueItems": true,
                    "items": {"$ref": "#/$defs/targeted_mutation_result"}
                }
            }
        }
    }
}
