{
  "base_commit": "77197964369cb8291f9a8b07ff1f7057f9c5b6f0",
  "branch": "codex/repository-hygiene",
  "checks": [
    {
      "category": "contract",
      "check_id": "contract",
      "command_summary": "C:\\Users\\Admin\\AppData\\Local\\Programs\\Python\\Python311\\python.exe -m aiflow validate TASK-0033",
      "duration_ms": 328,
      "exit_code": 0,
      "reason_code": null,
      "required": true,
      "status": "passed",
      "stderr_log_ref": "logs/run-20260901T143138226873Z/contract-001.stderr.log",
      "stdout_log_ref": "logs/run-20260901T143138226873Z/contract-001.stdout.log",
      "timed_out": false,
      "tool_version": "aiflow-local"
    },
    {
      "category": "scope",
      "check_id": "scope",
      "command_summary": "C:\\Users\\Admin\\AppData\\Local\\Programs\\Python\\Python311\\python.exe -m aiflow scope TASK-0033",
      "duration_ms": 625,
      "exit_code": 0,
      "reason_code": null,
      "required": true,
      "status": "passed",
      "stderr_log_ref": "logs/run-20260901T143138226873Z/scope-002.stderr.log",
      "stdout_log_ref": "logs/run-20260901T143138226873Z/scope-002.stdout.log",
      "timed_out": false,
      "tool_version": "aiflow-local"
    },
    {
      "category": "ruff_check",
      "check_id": "ruff_check",
      "command_summary": "C:\\Users\\Admin\\AppData\\Local\\Programs\\Python\\Python311\\python.exe -m ruff check .",
      "duration_ms": 516,
      "exit_code": 0,
      "reason_code": null,
      "required": true,
      "status": "passed",
      "stderr_log_ref": "logs/run-20260901T143138226873Z/ruff_check-003.stderr.log",
      "stdout_log_ref": "logs/run-20260901T143138226873Z/ruff_check-003.stdout.log",
      "timed_out": false,
      "tool_version": "ruff:0.16.5"
    },
    {
      "category": "ruff_format_check",
      "check_id": "ruff_format_check",
      "command_summary": "C:\\Users\\Admin\\AppData\\Local\\Programs\\Python\\Python311\\python.exe -m ruff format --check .",
      "duration_ms": 281,
      "exit_code": 0,
      "reason_code": null,
      "required": true,
      "status": "passed",
      "stderr_log_ref": "logs/run-20260901T143138226873Z/ruff_format_check-004.stderr.log",
      "stdout_log_ref": "logs/run-20260901T143138226873Z/ruff_format_check-004.stdout.log",
      "timed_out": false,
      "tool_version": "ruff:0.16.5"
    },
    {
      "category": "smoke",
      "check_id": "smoke",
      "command_summary": "C:\\Users\\Admin\\AppData\\Local\\Programs\\Python\\Python311\\python.exe -m aiflow --help",
      "duration_ms": 235,
      "exit_code": 0,
      "reason_code": null,
      "required": true,
      "status": "passed",
      "stderr_log_ref": "logs/run-20260901T143138226873Z/smoke-005.stderr.log",
      "stdout_log_ref": "logs/run-20260901T143138226873Z/smoke-005.stdout.log",
      "timed_out": false,
      "tool_version": "aiflow-local"
    },
    {
      "category": "unit_tests",
      "check_id": "unit_tests",
      "command_summary": "C:\\Users\\Admin\\AppData\\Local\\Programs\\Python\\Python311\\python.exe -m pytest tests/unit -q",
      "duration_ms": 52125,
      "exit_code": 1,
      "reason_code": "VERIFICATION_COMMAND_FAILED",
      "required": true,
      "status": "failed",
      "stderr_log_ref": "logs/run-20260901T143138226873Z/unit_tests-006.stderr.log",
      "stdout_log_ref": "logs/run-20260901T143138226873Z/unit_tests-006.stdout.log",
      "timed_out": false,
      "tool_version": "pytest:9.1.1"
    },
    {
      "category": "regression_tests",
      "check_id": "regression_tests",
      "command_summary": "C:\\Users\\Admin\\AppData\\Local\\Programs\\Python\\Python311\\python.exe -m pytest -q",
      "duration_ms": 554875,
      "exit_code": 1,
      "reason_code": "VERIFICATION_COMMAND_FAILED",
      "required": true,
      "status": "failed",
      "stderr_log_ref": "logs/run-20260901T143138226873Z/regression_tests-007.stderr.log",
      "stdout_log_ref": "logs/run-20260901T143138226873Z/regression_tests-007.stdout.log",
      "timed_out": false,
      "tool_version": "pytest:9.1.1"
    },
    {
      "category": "mypy",
      "check_id": "mypy",
      "command_summary": "C:\\Users\\Admin\\AppData\\Local\\Programs\\Python\\Python311\\python.exe -m mypy src",
      "duration_ms": 2187,
      "exit_code": 0,
      "reason_code": null,
      "required": true,
      "status": "passed",
      "stderr_log_ref": "logs/run-20260901T143138226873Z/mypy-008.stderr.log",
      "stdout_log_ref": "logs/run-20260901T143138226873Z/mypy-008.stdout.log",
      "timed_out": false,
      "tool_version": "mypy:1.20.2"
    },
    {
      "category": "coverage_xml",
      "check_id": "coverage_xml",
      "command_summary": "C:\\Users\\Admin\\AppData\\Local\\Programs\\Python\\Python311\\python.exe -m pytest --cov=aiflow --cov-branch --cov-report=xml:D:/Repos/harness-model/.ai/tasks/TASK-0033/logs/run-20260901T143138226873Z/coverage.xml",
      "duration_ms": 751140,
      "exit_code": 1,
      "reason_code": "VERIFICATION_COMMAND_FAILED",
      "required": true,
      "status": "failed",
      "stderr_log_ref": "logs/run-20260901T143138226873Z/coverage_xml-009.stderr.log",
      "stdout_log_ref": "logs/run-20260901T143138226873Z/coverage_xml-009.stdout.log",
      "timed_out": false,
      "tool_version": "pytest:9.1.1"
    },
    {
      "category": "diff_coverage",
      "check_id": "diff_coverage",
      "command_summary": "diff-cover D:/Repos/harness-model/.ai/tasks/TASK-0033/logs/run-20260901T143138226873Z/coverage.xml --compare-branch 77197964369cb8291f9a8b07ff1f7057f9c5b6f0 --fail-under 90",
      "duration_ms": 969,
      "exit_code": 0,
      "reason_code": null,
      "required": true,
      "status": "passed",
      "stderr_log_ref": "logs/run-20260901T143138226873Z/diff_coverage-010.stderr.log",
      "stdout_log_ref": "logs/run-20260901T143138226873Z/diff_coverage-010.stdout.log",
      "timed_out": false,
      "tool_version": "diff-cover:9.7.2"
    }
  ],
  "classification_input_sha256": "9727ec6478805caa0b304bcfb4a3d39ab423d3f2a6dbaddae6ff73bac2e2fffe",
  "conclusion": "failed",
  "decision_unit_ids": [
    "DU-001"
  ],
  "generated_at": "2026-09-01T14:54:21Z",
  "mode": "local",
  "policy_sha256": "1f684f4bf4bd2e3c28b7a04903628790f7be40f88a1dbf54587b09b90230267f",
  "repository_id": "b85e5a53-4935-4436-bdbc-c26a241bfae8",
  "reproduce_command": [
    "python",
    "-m",
    "aiflow",
    "verify",
    "TASK-0033",
    "--actor",
    "codex-primary"
  ],
  "schema_version": "1.0",
  "spec_sha256": "2b8a627f52a6c6c99c50ce8040f29d3e7cd5813cb904f6d5ffd37008a8ea0aa9",
  "subject_commit": "7278e10799a9306356a096a3fff1694521fb62e9",
  "task_id": "TASK-0033",
  "unverified_scenarios": [],
  "verification_level": "V1"
}
