{
  "base_commit": "e97d29ff69f67131a62c804781a2ca849d0879e8",
  "branch": "codex/maintenance-closeout",
  "checks": [
    {
      "category": "contract",
      "check_id": "contract",
      "command_summary": "D:\\Repos\\harness-model\\.venv\\Scripts\\python.exe -m aiflow validate TASK-0045",
      "duration_ms": 266,
      "exit_code": 0,
      "reason_code": null,
      "required": true,
      "status": "passed",
      "stderr_log_ref": "logs/run-20260907T061521798356Z/contract-001.stderr.log",
      "stdout_log_ref": "logs/run-20260907T061521798356Z/contract-001.stdout.log",
      "timed_out": false,
      "tool_version": "aiflow-local"
    },
    {
      "category": "scope",
      "check_id": "scope",
      "command_summary": "D:\\Repos\\harness-model\\.venv\\Scripts\\python.exe -m aiflow scope TASK-0045",
      "duration_ms": 453,
      "exit_code": 0,
      "reason_code": null,
      "required": true,
      "status": "passed",
      "stderr_log_ref": "logs/run-20260907T061521798356Z/scope-002.stderr.log",
      "stdout_log_ref": "logs/run-20260907T061521798356Z/scope-002.stdout.log",
      "timed_out": false,
      "tool_version": "aiflow-local"
    },
    {
      "category": "ruff_check",
      "check_id": "ruff_check",
      "command_summary": "D:\\Repos\\harness-model\\.venv\\Scripts\\python.exe -m ruff check .",
      "duration_ms": 110,
      "exit_code": 0,
      "reason_code": null,
      "required": true,
      "status": "passed",
      "stderr_log_ref": "logs/run-20260907T061521798356Z/ruff_check-003.stderr.log",
      "stdout_log_ref": "logs/run-20260907T061521798356Z/ruff_check-003.stdout.log",
      "timed_out": false,
      "tool_version": "ruff:0.16.1"
    },
    {
      "category": "ruff_format_check",
      "check_id": "ruff_format_check",
      "command_summary": "D:\\Repos\\harness-model\\.venv\\Scripts\\python.exe -m ruff format --check .",
      "duration_ms": 219,
      "exit_code": 0,
      "reason_code": null,
      "required": true,
      "status": "passed",
      "stderr_log_ref": "logs/run-20260907T061521798356Z/ruff_format_check-004.stderr.log",
      "stdout_log_ref": "logs/run-20260907T061521798356Z/ruff_format_check-004.stdout.log",
      "timed_out": false,
      "tool_version": "ruff:0.16.1"
    },
    {
      "category": "smoke",
      "check_id": "smoke",
      "command_summary": "D:\\Repos\\harness-model\\.venv\\Scripts\\python.exe -m aiflow --help",
      "duration_ms": 203,
      "exit_code": 0,
      "reason_code": null,
      "required": true,
      "status": "passed",
      "stderr_log_ref": "logs/run-20260907T061521798356Z/smoke-005.stderr.log",
      "stdout_log_ref": "logs/run-20260907T061521798356Z/smoke-005.stdout.log",
      "timed_out": false,
      "tool_version": "aiflow-local"
    },
    {
      "category": "unit_tests",
      "check_id": "unit_tests",
      "command_summary": "D:\\Repos\\harness-model\\.venv\\Scripts\\python.exe -m pytest tests/unit -q",
      "duration_ms": 24843,
      "exit_code": 0,
      "reason_code": null,
      "required": true,
      "status": "passed",
      "stderr_log_ref": "logs/run-20260907T061521798356Z/unit_tests-006.stderr.log",
      "stdout_log_ref": "logs/run-20260907T061521798356Z/unit_tests-006.stdout.log",
      "timed_out": false,
      "tool_version": "pytest:9.1.1"
    },
    {
      "category": "regression_tests",
      "check_id": "regression_tests",
      "command_summary": "D:\\Repos\\harness-model\\.venv\\Scripts\\python.exe -m pytest -q",
      "duration_ms": 410016,
      "exit_code": 0,
      "reason_code": null,
      "required": true,
      "status": "passed",
      "stderr_log_ref": "logs/run-20260907T061521798356Z/regression_tests-007.stderr.log",
      "stdout_log_ref": "logs/run-20260907T061521798356Z/regression_tests-007.stdout.log",
      "timed_out": false,
      "tool_version": "pytest:9.1.1"
    },
    {
      "category": "mypy",
      "check_id": "mypy",
      "command_summary": "D:\\Repos\\harness-model\\.venv\\Scripts\\python.exe -m mypy src",
      "duration_ms": 1516,
      "exit_code": 0,
      "reason_code": null,
      "required": true,
      "status": "passed",
      "stderr_log_ref": "logs/run-20260907T061521798356Z/mypy-008.stderr.log",
      "stdout_log_ref": "logs/run-20260907T061521798356Z/mypy-008.stdout.log",
      "timed_out": false,
      "tool_version": "mypy:1.20.2"
    },
    {
      "category": "coverage_xml",
      "check_id": "coverage_xml",
      "command_summary": "D:\\Repos\\harness-model\\.venv\\Scripts\\python.exe -m pytest --cov=aiflow --cov-branch --cov-report=xml:D:/Repos/harness-model/.claude/worktrees/codex-maintenance-closeout/.ai/tasks/TASK-0045/logs/run-20260907T061521798356Z/coverage.xml",
      "duration_ms": 466969,
      "exit_code": 0,
      "reason_code": null,
      "required": true,
      "status": "passed",
      "stderr_log_ref": "logs/run-20260907T061521798356Z/coverage_xml-009.stderr.log",
      "stdout_log_ref": "logs/run-20260907T061521798356Z/coverage_xml-009.stdout.log",
      "timed_out": false,
      "tool_version": "pytest:9.1.1"
    },
    {
      "category": "diff_coverage",
      "check_id": "diff_coverage",
      "command_summary": "diff-cover D:/Repos/harness-model/.claude/worktrees/codex-maintenance-closeout/.ai/tasks/TASK-0045/logs/run-20260907T061521798356Z/coverage.xml --compare-branch e97d29ff69f67131a62c804781a2ca849d0879e8 --fail-under 90",
      "duration_ms": 312,
      "exit_code": 0,
      "reason_code": null,
      "required": true,
      "status": "passed",
      "stderr_log_ref": "logs/run-20260907T061521798356Z/diff_coverage-010.stderr.log",
      "stdout_log_ref": "logs/run-20260907T061521798356Z/diff_coverage-010.stdout.log",
      "timed_out": false,
      "tool_version": "diff-cover:9.7.2"
    }
  ],
  "classification_input_sha256": "073a67fb6cf5068449720e28703ef22581f0ee7dfe663a40fe4fd98e1a0c9772",
  "conclusion": "passed",
  "decision_unit_ids": [
    "DU-001"
  ],
  "generated_at": "2026-09-07T06:30:26Z",
  "mode": "local",
  "policy_sha256": "1f684f4bf4bd2e3c28b7a04903628790f7be40f88a1dbf54587b09b90230267f",
  "repository_id": "b85e5a53-4935-4436-bdbc-c26a241bfae8",
  "reproduce_command": [
    "python",
    "-m",
    "aiflow",
    "verify",
    "TASK-0045",
    "--actor",
    "codex"
  ],
  "schema_version": "1.0",
  "spec_sha256": "8074ea2df252c96659992fb3c8d0fb5021f44da699e164b08c06dd885d099c27",
  "subject_commit": "6c7b73ab2b190b5659179118d5d4eb6ff7f3772c",
  "task_id": "TASK-0045",
  "unverified_scenarios": [],
  "verification_level": "V1"
}
