{
  "base_commit": "6c28ca605bec9c4dfeaf7ff7c7de8a6d4207d06a",
  "branch": "codex/e4-cumulative-delivery",
  "checks": [
    {
      "category": "contract",
      "check_id": "contract",
      "command_summary": "D:\\Repos\\_runtime\\e4-py313-20260930-001\\venv\\Scripts\\python.exe -m aiflow validate TASK-0059",
      "duration_ms": 278,
      "exit_code": 0,
      "reason_code": null,
      "required": true,
      "status": "passed",
      "stderr_log_ref": "logs/run-20261001T165629264962Z/contract-001.stderr.log",
      "stdout_log_ref": "logs/run-20261001T165629264962Z/contract-001.stdout.log",
      "timed_out": false,
      "tool_version": "aiflow-local"
    },
    {
      "category": "scope",
      "check_id": "scope",
      "command_summary": "D:\\Repos\\_runtime\\e4-py313-20260930-001\\venv\\Scripts\\python.exe -m aiflow scope TASK-0059",
      "duration_ms": 361,
      "exit_code": 0,
      "reason_code": null,
      "required": true,
      "status": "passed",
      "stderr_log_ref": "logs/run-20261001T165629264962Z/scope-002.stderr.log",
      "stdout_log_ref": "logs/run-20261001T165629264962Z/scope-002.stdout.log",
      "timed_out": false,
      "tool_version": "aiflow-local"
    },
    {
      "category": "ruff_check",
      "check_id": "ruff_check",
      "command_summary": "D:\\Repos\\_runtime\\e4-py313-20260930-001\\venv\\Scripts\\python.exe -m ruff check .",
      "duration_ms": 73,
      "exit_code": 0,
      "reason_code": null,
      "required": true,
      "status": "passed",
      "stderr_log_ref": "logs/run-20261001T165629264962Z/ruff_check-003.stderr.log",
      "stdout_log_ref": "logs/run-20261001T165629264962Z/ruff_check-003.stdout.log",
      "timed_out": false,
      "tool_version": "ruff:0.16.1"
    },
    {
      "category": "ruff_format_check",
      "check_id": "ruff_format_check",
      "command_summary": "D:\\Repos\\_runtime\\e4-py313-20260930-001\\venv\\Scripts\\python.exe -m ruff format --check .",
      "duration_ms": 69,
      "exit_code": 0,
      "reason_code": null,
      "required": true,
      "status": "passed",
      "stderr_log_ref": "logs/run-20261001T165629264962Z/ruff_format_check-004.stderr.log",
      "stdout_log_ref": "logs/run-20261001T165629264962Z/ruff_format_check-004.stdout.log",
      "timed_out": false,
      "tool_version": "ruff:0.16.1"
    },
    {
      "category": "smoke",
      "check_id": "smoke",
      "command_summary": "D:\\Repos\\_runtime\\e4-py313-20260930-001\\venv\\Scripts\\python.exe -m aiflow --help",
      "duration_ms": 207,
      "exit_code": 0,
      "reason_code": null,
      "required": true,
      "status": "passed",
      "stderr_log_ref": "logs/run-20261001T165629264962Z/smoke-005.stderr.log",
      "stdout_log_ref": "logs/run-20261001T165629264962Z/smoke-005.stdout.log",
      "timed_out": false,
      "tool_version": "aiflow-local"
    },
    {
      "category": "unit_tests",
      "check_id": "unit_tests",
      "command_summary": "D:\\Repos\\_runtime\\e4-py313-20260930-001\\venv\\Scripts\\python.exe -m pytest tests/unit -q --basetemp=D:/p/aiflow-pytest-TASK-0059-run-20261001T165629264962Z/pytest-EXEC-006 [pytest-argv-sha256:5e0f076837c8433673a37d6b26cbebde91616c6cff077eda05515be7bfd39c50]",
      "duration_ms": 120582,
      "exit_code": 0,
      "reason_code": null,
      "required": true,
      "status": "passed",
      "stderr_log_ref": "logs/run-20261001T165629264962Z/unit_tests-006.stderr.log",
      "stdout_log_ref": "logs/run-20261001T165629264962Z/unit_tests-006.stdout.log",
      "timed_out": false,
      "tool_version": "pytest:9.1.1"
    },
    {
      "category": "regression_tests",
      "check_id": "regression_tests",
      "command_summary": "D:\\Repos\\_runtime\\e4-py313-20260930-001\\venv\\Scripts\\python.exe -m pytest -q --basetemp=D:/p/aiflow-pytest-TASK-0059-run-20261001T165629264962Z/pytest-EXEC-007 [pytest-argv-sha256:ee7cf6c083c8298722e7267ff4e83656df8136ae59113d98980b531b451551ee]",
      "duration_ms": 662245,
      "exit_code": 0,
      "reason_code": null,
      "required": true,
      "status": "passed",
      "stderr_log_ref": "logs/run-20261001T165629264962Z/regression_tests-007.stderr.log",
      "stdout_log_ref": "logs/run-20261001T165629264962Z/regression_tests-007.stdout.log",
      "timed_out": false,
      "tool_version": "pytest:9.1.1"
    },
    {
      "category": "mypy",
      "check_id": "mypy",
      "command_summary": "D:\\Repos\\_runtime\\e4-py313-20260930-001\\venv\\Scripts\\python.exe -m mypy src",
      "duration_ms": 176,
      "exit_code": 0,
      "reason_code": null,
      "required": true,
      "status": "passed",
      "stderr_log_ref": "logs/run-20261001T165629264962Z/mypy-008.stderr.log",
      "stdout_log_ref": "logs/run-20261001T165629264962Z/mypy-008.stdout.log",
      "timed_out": false,
      "tool_version": "mypy:1.20.2"
    },
    {
      "category": "coverage_xml",
      "check_id": "coverage_xml",
      "command_summary": "D:\\Repos\\_runtime\\e4-py313-20260930-001\\venv\\Scripts\\python.exe -m pytest --cov=aiflow --cov-branch --cov-report=xml:C:/Users/Admin/.codex/worktrees/e4-follow-up/harness-model/.ai/tasks/TASK-0059/logs/run-20261001T165629264962Z/coverage.xml --basetemp=D:/p/aiflow-pytest-TASK-0059-run-20261001T165629264962Z/pytest-EXEC-009 [pytest-argv-sha256:ae4e91114b762c2150fd04d6a2f75fce808a80dd621d5555a3f2dab684381a0e]",
      "duration_ms": 764649,
      "exit_code": 0,
      "reason_code": null,
      "required": true,
      "status": "passed",
      "stderr_log_ref": "logs/run-20261001T165629264962Z/coverage_xml-009.stderr.log",
      "stdout_log_ref": "logs/run-20261001T165629264962Z/coverage_xml-009.stdout.log",
      "timed_out": false,
      "tool_version": "pytest:9.1.1"
    },
    {
      "category": "diff_coverage",
      "check_id": "diff_coverage",
      "command_summary": "diff-cover C:/Users/Admin/.codex/worktrees/e4-follow-up/harness-model/.ai/tasks/TASK-0059/logs/run-20261001T165629264962Z/coverage.xml --compare-branch 6c28ca605bec9c4dfeaf7ff7c7de8a6d4207d06a --fail-under 90",
      "duration_ms": 452,
      "exit_code": 0,
      "reason_code": null,
      "required": true,
      "status": "passed",
      "stderr_log_ref": "logs/run-20261001T165629264962Z/diff_coverage-010.stderr.log",
      "stdout_log_ref": "logs/run-20261001T165629264962Z/diff_coverage-010.stdout.log",
      "timed_out": false,
      "tool_version": "diff-cover:9.7.2"
    }
  ],
  "classification_input_sha256": "df51a266e6c71af280b443fae24d3d98ae9f986633b0b756f0b7aee35dc202d5",
  "conclusion": "passed",
  "decision_unit_ids": [
    "DU-001"
  ],
  "generated_at": "2026-10-01T17:22:18Z",
  "mode": "local",
  "policy_sha256": "d21a386779147dfad962a0fc0656bef61bc581e27f63c4789dcc06520fa10ff1",
  "repository_id": "b85e5a53-4935-4436-bdbc-c26a241bfae8",
  "reproduce_command": [
    "python",
    "-m",
    "aiflow",
    "verify",
    "TASK-0059",
    "--actor",
    "e4-publication-governance-root",
    "--pytest-temp-root",
    "${PYTEST_TEMP_ROOT}"
  ],
  "schema_version": "1.0",
  "spec_sha256": "cd3a5cc45c1e5c3b90d0f3daccf7396b2c7def6083b1a9072ec135731a026ec3",
  "subject_commit": "6c28ca605bec9c4dfeaf7ff7c7de8a6d4207d06a",
  "task_id": "TASK-0059",
  "unverified_scenarios": [],
  "verification_level": "V1"
}
