{
  "base_commit": "65f2fb4140027ba09c6f0cbf710b26ce87a6cc5b",
  "branch": "main",
  "checks": [
    {
      "category": "contract",
      "check_id": "contract",
      "command_summary": "C:\\Users\\Admin\\AppData\\Local\\Temp\\aiflow-task0022-h1-1787760423037\\.venv\\Scripts\\python.exe -m aiflow validate TASK-0022",
      "duration_ms": 313,
      "exit_code": 0,
      "reason_code": null,
      "required": true,
      "status": "passed",
      "stderr_log_ref": "logs/run-20260826T160852705647Z/contract-001.stderr.log",
      "stdout_log_ref": "logs/run-20260826T160852705647Z/contract-001.stdout.log",
      "timed_out": false,
      "tool_version": "aiflow-local"
    },
    {
      "category": "scope",
      "check_id": "scope",
      "command_summary": "C:\\Users\\Admin\\AppData\\Local\\Temp\\aiflow-task0022-h1-1787760423037\\.venv\\Scripts\\python.exe -m aiflow scope TASK-0022",
      "duration_ms": 437,
      "exit_code": 0,
      "reason_code": null,
      "required": true,
      "status": "passed",
      "stderr_log_ref": "logs/run-20260826T160852705647Z/scope-002.stderr.log",
      "stdout_log_ref": "logs/run-20260826T160852705647Z/scope-002.stdout.log",
      "timed_out": false,
      "tool_version": "aiflow-local"
    },
    {
      "category": "ruff_check",
      "check_id": "ruff_check",
      "command_summary": "C:\\Users\\Admin\\AppData\\Local\\Temp\\aiflow-task0022-h1-1787760423037\\.venv\\Scripts\\python.exe -m ruff check .",
      "duration_ms": 500,
      "exit_code": 0,
      "reason_code": null,
      "required": true,
      "status": "passed",
      "stderr_log_ref": "logs/run-20260826T160852705647Z/ruff_check-003.stderr.log",
      "stdout_log_ref": "logs/run-20260826T160852705647Z/ruff_check-003.stdout.log",
      "timed_out": false,
      "tool_version": "ruff:0.16.1"
    },
    {
      "category": "ruff_format_check",
      "check_id": "ruff_format_check",
      "command_summary": "C:\\Users\\Admin\\AppData\\Local\\Temp\\aiflow-task0022-h1-1787760423037\\.venv\\Scripts\\python.exe -m ruff format --check .",
      "duration_ms": 219,
      "exit_code": 0,
      "reason_code": null,
      "required": true,
      "status": "passed",
      "stderr_log_ref": "logs/run-20260826T160852705647Z/ruff_format_check-004.stderr.log",
      "stdout_log_ref": "logs/run-20260826T160852705647Z/ruff_format_check-004.stdout.log",
      "timed_out": false,
      "tool_version": "ruff:0.16.1"
    },
    {
      "category": "smoke",
      "check_id": "smoke",
      "command_summary": "C:\\Users\\Admin\\AppData\\Local\\Temp\\aiflow-task0022-h1-1787760423037\\.venv\\Scripts\\python.exe -m aiflow --help",
      "duration_ms": 234,
      "exit_code": 0,
      "reason_code": null,
      "required": true,
      "status": "passed",
      "stderr_log_ref": "logs/run-20260826T160852705647Z/smoke-005.stderr.log",
      "stdout_log_ref": "logs/run-20260826T160852705647Z/smoke-005.stdout.log",
      "timed_out": false,
      "tool_version": "aiflow-local"
    },
    {
      "category": "unit_tests",
      "check_id": "unit_tests",
      "command_summary": "C:\\Users\\Admin\\AppData\\Local\\Temp\\aiflow-task0022-h1-1787760423037\\.venv\\Scripts\\python.exe -m pytest tests/unit -q",
      "duration_ms": 24719,
      "exit_code": 0,
      "reason_code": null,
      "required": true,
      "status": "passed",
      "stderr_log_ref": "logs/run-20260826T160852705647Z/unit_tests-006.stderr.log",
      "stdout_log_ref": "logs/run-20260826T160852705647Z/unit_tests-006.stdout.log",
      "timed_out": false,
      "tool_version": "pytest:9.1.1"
    },
    {
      "category": "regression_tests",
      "check_id": "regression_tests",
      "command_summary": "C:\\Users\\Admin\\AppData\\Local\\Temp\\aiflow-task0022-h1-1787760423037\\.venv\\Scripts\\python.exe -m pytest -q",
      "duration_ms": 340578,
      "exit_code": 0,
      "reason_code": null,
      "required": true,
      "status": "passed",
      "stderr_log_ref": "logs/run-20260826T160852705647Z/regression_tests-007.stderr.log",
      "stdout_log_ref": "logs/run-20260826T160852705647Z/regression_tests-007.stdout.log",
      "timed_out": false,
      "tool_version": "pytest:9.1.1"
    },
    {
      "category": "mypy",
      "check_id": "mypy",
      "command_summary": "C:\\Users\\Admin\\AppData\\Local\\Temp\\aiflow-task0022-h1-1787760423037\\.venv\\Scripts\\python.exe -m mypy src",
      "duration_ms": 1375,
      "exit_code": 0,
      "reason_code": null,
      "required": true,
      "status": "passed",
      "stderr_log_ref": "logs/run-20260826T160852705647Z/mypy-008.stderr.log",
      "stdout_log_ref": "logs/run-20260826T160852705647Z/mypy-008.stdout.log",
      "timed_out": false,
      "tool_version": "mypy:1.20.2"
    },
    {
      "category": "coverage_xml",
      "check_id": "coverage_xml",
      "command_summary": "C:\\Users\\Admin\\AppData\\Local\\Temp\\aiflow-task0022-h1-1787760423037\\.venv\\Scripts\\python.exe -m pytest --cov=aiflow --cov-branch --cov-report=xml:C:/Users/Admin/AppData/Local/Temp/aiflow-task0022-h1-1787760423037/.ai/tasks/TASK-0022/logs/run-20260826T160852705647Z/coverage.xml",
      "duration_ms": 424641,
      "exit_code": 0,
      "reason_code": null,
      "required": true,
      "status": "passed",
      "stderr_log_ref": "logs/run-20260826T160852705647Z/coverage_xml-009.stderr.log",
      "stdout_log_ref": "logs/run-20260826T160852705647Z/coverage_xml-009.stdout.log",
      "timed_out": false,
      "tool_version": "pytest:9.1.1"
    },
    {
      "category": "diff_coverage",
      "check_id": "diff_coverage",
      "command_summary": "diff-cover C:/Users/Admin/AppData/Local/Temp/aiflow-task0022-h1-1787760423037/.ai/tasks/TASK-0022/logs/run-20260826T160852705647Z/coverage.xml --compare-branch 65f2fb4140027ba09c6f0cbf710b26ce87a6cc5b --fail-under 90",
      "duration_ms": 344,
      "exit_code": 0,
      "reason_code": null,
      "required": true,
      "status": "passed",
      "stderr_log_ref": "logs/run-20260826T160852705647Z/diff_coverage-010.stderr.log",
      "stdout_log_ref": "logs/run-20260826T160852705647Z/diff_coverage-010.stdout.log",
      "timed_out": false,
      "tool_version": "diff-cover:9.7.2"
    }
  ],
  "classification_input_sha256": "72068c839a2f9e46dec59e3a9c2f1f84b2715d1bd11663fd8ddbb7867f9500c7",
  "conclusion": "passed",
  "decision_unit_ids": [
    "DU-001"
  ],
  "generated_at": "2026-08-26T16:22:06Z",
  "mode": "local",
  "policy_sha256": "f4854d7fa05e5bddc21303350476bf47568bfe50f64c9d1f9199c0d744321bbf",
  "repository_id": "b85e5a53-4935-4436-bdbc-c26a241bfae8",
  "reproduce_command": [
    "python",
    "-m",
    "aiflow",
    "verify",
    "TASK-0022",
    "--actor",
    "/root"
  ],
  "schema_version": "1.0",
  "spec_sha256": "c73fb731b0fa1f1577203e6087b97079297b27ebdf99e68f654dc8c6034a7cc1",
  "subject_commit": "f977b977dd47482e77bbc2067c9e1a41de470f41",
  "task_id": "TASK-0022",
  "unverified_scenarios": [],
  "verification_level": "V1"
}
